"Code","Identifier","Name_En","Name_Es","Name_Fr"
"03","1","Fish, crustaceans, molluscs and other aquatic invertebrates","Pescados y crustáceos, moluscos y demás invertebrados acuáticos","Poissons et crustacés, mollusques et autres invertébrés aquatiques"
"05","2","Products of animal origin, not elsewhere specified or included","Los demás productos de origen animal no expresados ni comprendidos en otra parte","Autres produits d'origine animale, non dénommés ni compris ailleurs"
"12","3","Oil seeds and oleaginous fruits, grains, seeds, plants, etc,","Semillas y frutos oleaginosos, semillas, plantas, etc.","Graines et fruits oléagineux, graines, semences, plantes, etc."
"13","4","Lac; gums, resins and other vegetable saps and extracts","Gomas, resinas y demás jugos y extractos vegetales","Gommes, résines et autres sucs et extraits végétaux"
"15","5","Animal or vegetable fats and oils and their cleavage products","Grasas y aceites animales o vegetales; productos de su desdoblamiento","Graisses et huiles animales ou végétales; produits de leur dissociation"
"16","6","Preparations of meat, of fish or of crustaceans, molluscs or other aquatic invertebrates","Preparaciones de carne, pescado o de crustáceos, moluscos o demás invertebrados acuáticos","Préparations de viande, de poissons ou de crustacés, de mollusques ou d'autres invertébrés aquatiques"
"21","7","Miscellaneous edible preparations","Preparaciones alimenticias diversas","Préparations alimentaires diverses"
"23","8","Residues and waste from the food industries; prepared animal fodder","Residuos y desperdicios de las industrias alimentarias; alimentos preparados para animales","Résidus et déchets des industries alimentaires; aliments préparés pour animaux"
